{
  "schema": "com.asharia.package-lock",
  "schemaVersion": 2,
  "resolver": {
    "version": "0.1.0",
    "policyVersion": 1
  },
  "inputs": {
    "engine": {
      "distributionId": "com.asharia.distribution.engine-0-1",
      "engineApiVersion": "0.1.0",
      "engineGenerationId": "sha256-6cde7eeb2af326e09c2183700fbb4ef36ef5fc6ab7ab3361e1a19564e013b409"
    },
    "projectManifestIntegrity": {
      "algorithm": "sha256",
      "digest": "aaaaaaaaaaaaaaaaaaaaaaaaaaaaaaaaaaaaaaaaaaaaaaaaaaaaaaaaaaaaaaaa"
    }
  },
  "roots": {
    "directPackages": [
      {
        "id": "com.asharia.system.synthetic-hosted",
        "version": "0.1.0",
        "packageKind": "installable-capability"
      }
    ],
    "directFeatureSets": []
  },
  "nodes": [
    {
      "id": "com.asharia.system.synthetic-hosted",
      "version": "0.1.0",
      "packageKind": "installable-capability",
      "source": {
        "kind": "local",
        "sourceId": "com.asharia.source.synthetic-hosted"
      },
      "manifestIntegrity": {
        "algorithm": "sha256",
        "digest": "bbbbbbbbbbbbbbbbbbbbbbbbbbbbbbbbbbbbbbbbbbbbbbbbbbbbbbbbbbbbbbbb"
      },
      "payloadIntegrity": {
        "algorithm": "sha256",
        "digest": "cccccccccccccccccccccccccccccccccccccccccccccccccccccccccccccccc"
      },
      "dependencies": []
    }
  ]
}
